{
  "$schema": "./programmes.schema.json",
  "version": 1,
  "asOf": "2026-10-14",
  "description": "THD degree programme and cohort-start taxonomy containing records with substantiated programme codes. This is a discovery aid, not proof of enrolment.",
  "codePolicy": {
    "verified": "The code is the programme-page slug from THD's bachelor or master catalogue (th-deg.de/<code>-b or -m), upper-cased without the level suffix, and that page is in the record's sources.",
    "provisional": "No programme page carries this code yet; do not use it as a cohort identifier. No record is provisional in this version."
  },
  "batchRules": {
    "batchIdentity": [
      "programme code",
      "intake term",
      "intake year"
    ],
    "recommendedDisambiguators": [
      "campus",
      "language",
      "study mode",
      "degree level"
    ],
    "displayExamples": [
      {
        "programmeCode": "AIN",
        "intakeTerm": "winter",
        "intakeYear": 2023,
        "displayInWinter2026": "AIN 7"
      },
      {
        "programmeCode": "KI",
        "intakeTerm": "winter",
        "intakeYear": 2023,
        "displayInWinter2026": "KI 7"
      }
    ],
    "currentSemesterLabels": {
      "winter": [
        1,
        3,
        5,
        7
      ],
      "summer": [
        2,
        4,
        6
      ]
    },
    "extensionSemesters": [
      8,
      9
    ],
    "notes": [
      "The displayed semester is the cohort's current curriculum semester for the current academic term; it is not a promise that a student has passed every previous semester.",
      "Keep AIN (English) and KI (German) as separate programmes.",
      "Some programmes have different start terms by language variant or campus, so use each record's intakeTerms rather than assuming every programme starts in both terms.",
      "Extension semesters 8 and 9 are allowed cohort labels, not separate programmes or intake terms.",
      "Where the same short code has multiple campuses or study modes, include campus and study mode in the stable cohort key to avoid collisions.",
      "Codes repeat across levels (KI, ET, MT, MB, ASW, WI, EM) and campuses (MCS in Deggendorf and Cham). Match batches on the record id, which is the page slug and unique, and show the code to people."
    ]
  },
  "sourceIndex": [
    {
      "id": "bachelorCatalogue",
      "title": "Bachelor degree programmes",
      "url": "https://www.th-deg.de/bachelorstudiengaenge",
      "supports": [
        "programme list",
        "programme-page links that carry the code"
      ],
      "accessedOn": "2026-10-14"
    },
    {
      "id": "masterCatalogue",
      "title": "Master degree programmes",
      "url": "https://www.th-deg.de/masterstudiengaenge",
      "supports": [
        "programme list",
        "programme-page links that carry the code"
      ],
      "accessedOn": "2026-10-14"
    },
    {
      "id": "focusSessionsSpec",
      "title": "Focus sessions specification: batches",
      "url": "https://github.com/arudaev/THD-Room-Finder/blob/main/docs/product/focus-sessions.md#batches",
      "supports": [
        "batch identity",
        "semester labels"
      ],
      "accessedOn": "2026-10-14"
    },
    {
      "id": "moduleHandbooks",
      "title": "Official module handbook index",
      "url": "https://www.th-deg.de/en/students/documents",
      "supports": [
        "current official module-handbook index",
        "corroborating programme-code conventions where a programme handbook is listed"
      ],
      "accessedOn": "2026-10-18"
    },
    {
      "id": "page-ae-m",
      "title": "Car IT und Elektronik, M.Eng. (programme page)",
      "url": "https://www.th-deg.de/ae-m",
      "supports": [
        "excluded: taught at OTH Regensburg"
      ],
      "accessedOn": "2026-10-14"
    },
    {
      "id": "page-hrm-m",
      "title": "Human Resource Management, M.A. (programme page)",
      "url": "https://www.th-deg.de/hrm-m",
      "supports": [
        "excluded: run with OTH Regensburg"
      ],
      "accessedOn": "2026-10-14"
    },
    {
      "id": "page-ai-m",
      "title": "Angewandte Informatik - Infotronik, M.Sc. (programme page)",
      "url": "https://www.th-deg.de/ai-m",
      "supports": [
        "code",
        "award",
        "faculty",
        "campus",
        "intake terms",
        "duration",
        "language",
        "German name"
      ],
      "accessedOn": "2026-10-14"
    },
    {
      "id": "page-ai-m-en",
      "title": "Applied Computer Science, M.Sc. (English programme page)",
      "url": "https://www.th-deg.de/ai-m-en",
      "supports": [
        "English name"
      ],
      "accessedOn": "2026-10-14"
    },
    {
      "id": "page-aid-m",
      "title": "Artificial Intelligence and Data Science, M.Sc. (programme page)",
      "url": "https://www.th-deg.de/aid-m",
      "supports": [
        "code",
        "award",
        "faculty",
        "campus",
        "intake terms",
        "duration",
        "language",
        "German name"
      ],
      "accessedOn": "2026-10-14"
    },
    {
      "id": "page-aid-m-en",
      "title": "Artificial Intelligence and Data Science, M.Sc. (English programme page)",
      "url": "https://www.th-deg.de/aid-m-en",
      "supports": [
        "English name"
      ],
      "accessedOn": "2026-10-14"
    },
    {
      "id": "page-aif-b",
      "title": "Angewandte Informatik, B.Eng. (programme page)",
      "url": "https://www.th-deg.de/aif-b",
      "supports": [
        "code",
        "award",
        "faculty",
        "campus",
        "intake terms",
        "duration",
        "language",
        "German name"
      ],
      "accessedOn": "2026-10-14"
    },
    {
      "id": "page-aif-b-en",
      "title": "Applied Computer Science, B.Eng. (English programme page)",
      "url": "https://www.th-deg.de/aif-b-en",
      "supports": [
        "English name"
      ],
      "accessedOn": "2026-10-14"
    },
    {
      "id": "page-ain-b",
      "title": "Artificial Intelligence, B.Sc. (programme page)",
      "url": "https://www.th-deg.de/ain-b",
      "supports": [
        "code",
        "award",
        "faculty",
        "campus",
        "intake terms",
        "duration",
        "language",
        "German name"
      ],
      "accessedOn": "2026-10-14"
    },
    {
      "id": "page-ain-b-en",
      "title": "Artificial Intelligence, B.Sc. (English programme page)",
      "url": "https://www.th-deg.de/ain-b-en",
      "supports": [
        "English name"
      ],
      "accessedOn": "2026-10-14"
    },
    {
      "id": "page-anv-b",
      "title": "Außerklinische Akut- und Notfallversorgung, B.Sc. (programme page)",
      "url": "https://www.th-deg.de/anv-b",
      "supports": [
        "code",
        "award",
        "faculty",
        "campus",
        "intake terms",
        "duration",
        "language",
        "German name"
      ],
      "accessedOn": "2026-10-14"
    },
    {
      "id": "page-anv-b-en",
      "title": "Emergency Paramedic, B.Sc. (English programme page)",
      "url": "https://www.th-deg.de/anv-b-en",
      "supports": [
        "English name"
      ],
      "accessedOn": "2026-10-14"
    },
    {
      "id": "page-ar-m",
      "title": "Applied Research in Engineering Sciences, M.Sc. (programme page)",
      "url": "https://www.th-deg.de/ar-m",
      "supports": [
        "code",
        "award",
        "faculty",
        "campus",
        "intake terms",
        "duration",
        "language",
        "German name"
      ],
      "accessedOn": "2026-10-14"
    },
    {
      "id": "page-ar-m-en",
      "title": "Applied Research in Engineering Sciences, M.Sc. (English programme page)",
      "url": "https://www.th-deg.de/ar-m-en",
      "supports": [
        "English name"
      ],
      "accessedOn": "2026-10-14"
    },
    {
      "id": "page-ase-m",
      "title": "Automotive Software Engineering, M.Eng. (programme page)",
      "url": "https://www.th-deg.de/ase-m",
      "supports": [
        "code",
        "award",
        "faculty",
        "campus",
        "intake terms",
        "duration",
        "language",
        "German name"
      ],
      "accessedOn": "2026-10-14"
    },
    {
      "id": "page-ase-m-en",
      "title": "Automotive Software Engineering, M.Eng. (English programme page)",
      "url": "https://www.th-deg.de/ase-m-en",
      "supports": [
        "English name"
      ],
      "accessedOn": "2026-10-14"
    },
    {
      "id": "page-asw-b",
      "title": "Angewandte Sportwissenschaften mit Schwerpunkt Training und Gesundheit, B.Sc. (programme page)",
      "url": "https://www.th-deg.de/asw-b",
      "supports": [
        "code",
        "award",
        "faculty",
        "campus",
        "intake terms",
        "duration",
        "language",
        "German name"
      ],
      "accessedOn": "2026-10-14"
    },
    {
      "id": "page-asw-b-en",
      "title": "Applied Sports Science, B.Sc. (English programme page)",
      "url": "https://www.th-deg.de/asw-b-en",
      "supports": [
        "English name"
      ],
      "accessedOn": "2026-10-14"
    },
    {
      "id": "page-asw-m",
      "title": "Angewandte Sportwissenschaften, M.Sc. (programme page)",
      "url": "https://www.th-deg.de/asw-m",
      "supports": [
        "code",
        "award",
        "faculty",
        "campus",
        "intake terms",
        "duration",
        "language",
        "German name"
      ],
      "accessedOn": "2026-10-14"
    },
    {
      "id": "page-asw-m-en",
      "title": "Applied Sports Science with Focus on Interprofessional Care in Sports, M.Sc. (English programme page)",
      "url": "https://www.th-deg.de/asw-m-en",
      "supports": [
        "English name"
      ],
      "accessedOn": "2026-10-14"
    },
    {
      "id": "page-avw-b",
      "title": "Verkehrswissenschaften, B.Sc. (programme page)",
      "url": "https://www.th-deg.de/avw-b",
      "supports": [
        "code",